{
  "contract_version": "sovereign-inference/v1",
  "request_id": "8da2153c-16ca-47f9-b0ee-6d8b957add4c",
  "correlation_id": "sovereign-201-allowed-001",
  "identity": {"subject": "spiffe://workshop.example/learner", "trust_domain": "workshop.example"},
  "residency": {"data_origin": "local", "approved_regions": ["local", "eu-central"], "destination_region": "local"},
  "data_classification": "general",
  "requested_model": "granite-3.2-sovereign",
  "prompt": "Explain why deterministic policy must precede model inference.",
  "final_decision_owner": "human-reviewer"
}

